{
  "schema_version": 1,
  "id": "CHG-008",
  "title": "Read-only review health and Work handoff",
  "phase": "building",
  "risk": "low",
  "intent": {
    "user": "Builder maintaining a product in ChatGPT Work",
    "problem": "A green push review can hide a missing schedule or stale installed copy",
    "outcome": "See current evidence and recover product work without silent changes",
    "non_goals": [
      "No remote repairs or automatic skill overwrite",
      "No unattended intent sync",
      "No invented human outcomes"
    ]
  },
  "sources": [
    {
      "id": "SRC-APPROVAL",
      "kind": "user",
      "reference": "docs/CHANGE-008.md",
      "statement": "User asked to work through each of the four proposed steps one by one."
    }
  ],
  "requirements": [
    {
      "id": "REQ-001",
      "statement": "Distinguish scheduled execution from push/manual and current-main review with complete fresh target-bound evidence.",
      "source_ids": [
        "SRC-APPROVAL"
      ],
      "criteria": [
        {
          "id": "AC-001",
          "statement": "Distinguish scheduled execution from push/manual and current-main review with complete fresh target-bound evidence."
        }
      ]
    },
    {
      "id": "REQ-002",
      "statement": "Require review job, receipt-validation step and artifact metadata; preserve waiting, missed, failed and unverified states.",
      "source_ids": [
        "SRC-APPROVAL"
      ],
      "criteria": [
        {
          "id": "AC-002",
          "statement": "Require review job, receipt-validation step and artifact metadata; preserve waiting, missed, failed and unverified states."
        }
      ]
    },
    {
      "id": "REQ-003",
      "statement": "Check explicit installed bundle identity and versions without writes; preserve recoverable project intent.",
      "source_ids": [
        "SRC-APPROVAL"
      ],
      "criteria": [
        {
          "id": "AC-003",
          "statement": "Check explicit installed bundle identity and versions without writes; preserve recoverable project intent."
        }
      ]
    }
  ],
  "assumptions": [
    {
      "id": "ASM-SCOPE",
      "statement": "Spec Loop itself is the product for this bounded technical feature cycle.",
      "impact": "low",
      "status": "accepted",
      "basis": "User approved sequential work; no separate application was supplied. Human pilot remains separate."
    }
  ],
  "depends_on": [],
  "artifacts": [
    {
      "id": "ART-DESIGN",
      "kind": "design",
      "path": "docs/CHANGE-008.md"
    },
    {
      "id": "ART-ARCHITECTURE",
      "kind": "architecture",
      "path": "docs/REVIEW_HEALTH.md"
    },
    {
      "id": "ART-RELEASE",
      "kind": "release",
      "path": ".spec-loop/artifacts/health-release.md"
    },
    {
      "id": "ART-OPERATIONS",
      "kind": "operations",
      "path": ".spec-loop/artifacts/health-operations.md"
    }
  ],
  "tasks": [
    {
      "id": "TASK-001",
      "title": "Read-only review health and Work handoff",
      "requirement_ids": [
        "REQ-001",
        "REQ-002",
        "REQ-003"
      ],
      "depends_on": [],
      "status": "done",
      "write_scope": [
        "scripts/review_health.py",
        "tests/test_review_health.py",
        "docs/review-health-policy.json",
        "docs/REVIEW_HEALTH.md",
        "WORK_STATE.md"
      ]
    }
  ],
  "checks": [
    {
      "id": "CHK-ACCEPT",
      "kind": "automated",
      "purpose": "acceptance",
      "covers": [
        "AC-001",
        "AC-002",
        "AC-003"
      ],
      "argv": [
        "python3",
        "-m",
        "unittest",
        "discover",
        "-s",
        "tests",
        "-p",
        "test_review_health.py",
        "-v"
      ],
      "procedure": "",
      "timeout_seconds": 60
    },
    {
      "id": "CHK-RELEASE",
      "kind": "manual",
      "purpose": "release",
      "covers": [],
      "argv": [],
      "procedure": "Inspect source package and Work bundle exports; record actual local module release scope and artifact hash.",
      "timeout_seconds": 60
    },
    {
      "id": "CHK-OPS",
      "kind": "manual",
      "purpose": "operations",
      "covers": [],
      "argv": [],
      "procedure": "Run against live GitHub MCP observations and the explicit installed bundle; resume native context. Record technical results and missing human outcome.",
      "timeout_seconds": 60
    },
    {
      "id": "CHK-OUTCOME",
      "kind": "manual",
      "purpose": "outcome",
      "covers": [],
      "argv": [],
      "procedure": "Observe a real builder use review health in a new Work conversation and provide feedback. Keep open without human participation.",
      "timeout_seconds": 60
    }
  ],
  "product_scope": "fa02bed07d4825267d89da5d2bbf410b6d5f9c3445360727243c9b65727517b2",
  "product_review": {
    "scope": "fa02bed07d4825267d89da5d2bbf410b6d5f9c3445360727243c9b65727517b2",
    "actor": "chatgpt-work",
    "reason": "Review health is a bounded technical feature in the Work pilot, not human acceptance.",
    "authority_ref": "User approved sequential next steps",
    "at": "2026-09-08T16:29:18.460440+00:00"
  }
}
